{
  "$schema": "https://raw.githubusercontent.com/my-harness/my-harness/main/harness.schema.json",
  "project_name": "my-harness",
  "preset": "universal",
  "git": {
    "protected_branches": [
      "main",
      "master"
    ],
    "enforce_branch_safety": true
  },
  "guardrails": {
    "reminders": [
      "1. Contract-First: Define interfaces, schemas & types before implementing logic.",
      "2. TDD: Write failing tests before writing production code.",
      "3. Micro-Validation: Run `python .agents/scripts/verify_shift_left.py --changed` after every file edit.",
      "4. Branch Safety: Never commit directly to main/master."
    ]
  },
  "rules": {
    "banned_imports": [],
    "banned_patterns": [],
    "vue_template_rules": {
      "banned_tags": [],
      "banned_attributes": []
    }
  },
  "commands": {
    "type_check": "",
    "lint": "ruff check .",
    "test": "pytest",
    "build": ""
  }
}